{
  "kind": "instruction.spec",
  "schema": "cac.instruction_spec.v1",
  "schema_version": "1.0.0",
  "meta": {
    "classification": "INTERNAL",
    "created_at": "2026-02-02T00:00:00Z",
    "dependencies": [
      {
        "stable_id": "dcp://apm2.local/instructions/rfc_council/finding_categories@v0"
      }
    ],
    "labels": [
      "rfc-council",
      "remediate-mode",
      "v0"
    ],
    "provenance": {
      "actor_id": "HOLON-INSTR-EMITTER",
      "work_id": "rfc_council_remediate_mode_v0"
    },
    "stable_id": "dcp://apm2.local/instructions/rfc_council/remediate_mode@v0"
  },
  "payload": {
    "i": "REMEDIATE mode flow (Load findings -> Diagnose -> Fix -> Verify).",
    "pb": "Provide CAC-native steps to systematically resolve BLOCKER/MAJOR findings.",
    "t": {
      "sys": "APM2",
      "repo": "/home/ubuntu/Projects/apm2-rfc-consensus",
      "scope": [
        "documents/skills/rfc-council/references/remediate-mode.md"
      ]
    },
    "ctx": [
      "documents/skills/rfc-council/references/remediate-mode.md",
      "documents/skills/modes-of-reasoning/artifacts/selector.json"
    ],
    "lex": {
      "R1": "Load Evidence: Identify the latest evidence bundle at `evidence/rfc/{RFC_ID}/reviews/rfc_review_*.yaml`; load ALL findings associated with this verdict into the remediation session (do not filter by severity).",
      "R2": "Run Council: Spawn SA-1/2/3 to jointly Diagnose (Mode 41) and Design Fixes (Mode 70) for all findings, ensuring consensus on the remediation plan.",
      "R3": "Diagnostic (Mode 41) & Design Fix (Mode 70): Execute the remediation plan derived by the council; must respect `02_design_decisions`.",
      "R4": "Apply Fix: Execute file edits on tickets or RFC YAMLs.",
      "R5": "Verify (Mode 8): Check if fix introduces new issues (Counterexample); re-run specific gate if deterministic.",
      "R6": "Emit Bundle: Generate new evidence bundle to `evidence/rfc/{RFC_ID}/reviews/rfc_review_{timestamp}.yaml` with finding statuses updated to RESOLVED_PROVISIONAL."
    },
    "dir": [
      ["D1", 3, "@R1", ["load"], []],
      ["D2", 3, "@R2", ["council"], []],
      ["D3", 3, "@R3", ["diagnose", "dcp://apm2.agents/mor/mode/diagnostic@1", "dcp://apm2.agents/mor/mode/engineering-design@1"], []],
      ["D4", 3, "@R4", ["apply"], []],
      ["D5", 3, "@R5", ["verify", "dcp://apm2.agents/mor/mode/counterexample-guided@1"], []],
      ["D6", 3, "@R6", ["emit"], []]
    ],
    "g": [
      ["G-SOURCE", "D", 1, ["@R1", "@R2", "@R3", "@R4", "@R5", "@R6"], ["E1"], "FAIL_IF_MISSING"]
    ],
    "ev": [
      ["E1", "source_doc", true, "md", ["documents/skills/rfc-council/references/remediate-mode.md"], []]
    ],
    "chg": [
      ["C1", "CFG", ["documents/skills/rfc-council/references/remediate-mode.md"], ["documents/skills/rfc-council/references/remediate-mode.md#L1"], "Canonicalize remediate flow into instruction.spec"]
    ],
    "r": {
      "depth": "M",
      "modes": [
        "incident_response",
        "engineering_safety"
      ],
      "ob": [
        "A",
        "R",
        "I",
        "V",
        "E",
        "D",
        "S"
      ],
      "trace": "C"
    },
    "out": [
      ["instruction.spec", "dcp://apm2.local/instructions/rfc_council/remediate_mode@v0", "cac.instruction_spec.v1"]
    ],
    "q": [
      "Findings loaded from bundle",
      "Fixes applied to files",
      "New bundle emitted with RESOLVED statuses"
    ]
  }
}
