{
  "kind": "bundle.manifest",
  "schema": "cac.bundle_manifest.v1",
  "schema_version": "1.0.0",
  "meta": {
    "classification": "INTERNAL",
    "created_at": "2026-01-28T00:00:00Z",
    "dependencies": [],
    "labels": [
      "rfc-council",
      "bundle",
      "v0"
    ],
    "provenance": {
      "actor_id": "HOLON-INSTR-EMITTER",
      "work_id": "rfc_council_bundle_v0"
    },
    "stable_id": "dcp://apm2.local/bundles/rfc_council@v0"
  },
  "payload": {
    "bundle_id": "rfc_council@v0",
    "generated_at": "2026-01-28T00:00:00Z",
    "index_ref": "documents/skills/rfc-council/assets/index.json",
    "skill_spec": {
      "stable_id": "dcp://apm2.local/skills/rfc-council@v0",
      "path": "documents/skills/rfc-council/assets/skill.rfc_council.v0.json"
    },
    "instruction_specs": [
      {
        "id": "skill",
        "stable_id": "dcp://apm2.local/instructions/rfc_council/skill@v0",
        "path": "documents/skills/rfc-council/assets/instruction.rfc_council.skill.v0.json"
      },
      {
        "id": "workflow",
        "stable_id": "dcp://apm2.local/instructions/rfc_council/workflow@v0",
        "path": "documents/skills/rfc-council/assets/instruction.rfc_council.workflow.v0.json"
      },
      {
        "id": "review_mode",
        "stable_id": "dcp://apm2.local/instructions/rfc_council/review_mode@v0",
        "path": "documents/skills/rfc-council/assets/instruction.rfc_council.review_mode.v0.json"
      },
      {
        "id": "review_rubric",
        "stable_id": "dcp://apm2.local/instructions/rfc_council/review_rubric@v0",
        "path": "documents/skills/rfc-council/assets/instruction.rfc_council.review_rubric.v0.json"
      },
      {
        "id": "council_protocol",
        "stable_id": "dcp://apm2.local/instructions/rfc_council/council_protocol@v0",
        "path": "documents/skills/rfc-council/assets/instruction.rfc_council.council_protocol.v0.json"
      },
      {
        "id": "create_mode",
        "stable_id": "dcp://apm2.local/instructions/rfc_council/create_mode@v0",
        "path": "documents/skills/rfc-council/assets/instruction.rfc_council.create_mode.v0.json"
      },
      {
        "id": "explore_mode",
        "stable_id": "dcp://apm2.local/instructions/rfc_council/explore_mode@v0",
        "path": "documents/skills/rfc-council/assets/instruction.rfc_council.explore_mode.v0.json"
      },
      {
        "id": "closure_mode",
        "stable_id": "dcp://apm2.local/instructions/rfc_council/closure_mode@v0",
        "path": "documents/skills/rfc-council/assets/instruction.rfc_council.closure_mode.v0.json"
      },
      {
        "id": "finding_categories",
        "stable_id": "dcp://apm2.local/instructions/rfc_council/finding_categories@v0",
        "path": "documents/skills/rfc-council/assets/instruction.rfc_council.finding_categories.v0.json"
      },
      {
        "id": "commands",
        "stable_id": "dcp://apm2.local/instructions/rfc_council/commands@v0",
        "path": "documents/skills/rfc-council/assets/instruction.rfc_council.commands.v0.json"
      }
    ],
    "notes": [
      "SKILL.md and reference markdown remain authoritative human-facing sources.",
      "instruction.spec artifacts provide CAC-native, token-efficient execution contracts."
    ]
  }
}
