{
  "kind": "instruction.spec",
  "schema": "cac.instruction_spec.v1",
  "schema_version": "1.0.0",
  "meta": {
    "classification": "INTERNAL",
    "created_at": "2026-01-28T00:00:00Z",
    "dependencies": [],
    "labels": [
      "rfc-council",
      "commands",
      "v0"
    ],
    "provenance": {
      "actor_id": "HOLON-INSTR-EMITTER",
      "work_id": "rfc_council_commands_v0"
    },
    "stable_id": "dcp://apm2.local/instructions/rfc_council/commands@v0"
  },
  "payload": {
    "i": "RFC Council CLI commands and options.",
    "pb": "Provide CAC-native mapping of commands to modes and outputs.",
    "t": {
      "sys": "APM2",
      "repo": "/home/ubuntu/Projects/apm2-rfc-consensus",
      "scope": [
        "documents/skills/rfc-council/references/commands.md"
      ]
    },
    "ctx": [
      "documents/skills/rfc-council/references/commands.md"
    ],
    "lex": {
      "C1": "Commands: create, evolve, explore, finalize, review, review-council, implicit-review.",
      "C2": "Options: --council, --depth STANDARD|COUNCIL, --dry-run.",
      "C3": "Outputs: create => RFC+tickets; review => evidence bundle path.",
      "C4": "Exit codes: 0=success, 1=rejected, 2=needs human, 3=aborted."
    },
    "dir": [
      ["D1", 3, "@C1", ["commands"], []],
      ["D2", 2, "@C2", ["options"], []],
      ["D3", 2, "@C3", ["outputs"], []],
      ["D4", 2, "@C4", ["exit"], []]
    ],
    "g": [
      ["G-SOURCE", "D", 1, ["@C1", "@C2", "@C3", "@C4"], ["E1"], "FAIL_IF_MISSING"]
    ],
    "ev": [
      ["E1", "source_doc", true, "md", ["documents/skills/rfc-council/references/commands.md"], []]
    ],
    "chg": [
      ["C1", "CFG", ["documents/skills/rfc-council/references/commands.md"], ["documents/skills/rfc-council/references/commands.md#L1"], "Canonicalize command reference into instruction.spec"]
    ],
    "r": {
      "depth": "S",
      "modes": [
        47,
        36,
        79
      ],
      "ob": [
        "A",
        "R",
        "I",
        "V",
        "E",
        "D",
        "S"
      ],
      "trace": "C"
    },
    "out": [
      ["instruction.spec", "dcp://apm2.local/instructions/rfc_council/commands@v0", "cac.instruction_spec.v1"]
    ],
    "q": [
      "All commands listed",
      "Exit codes captured"
    ]
  }
}
