{
  "kind": "receipt.run",
  "meta": {
    "classification": "INTERNAL",
    "created_at": "2026-01-26T01:10:00Z",
    "dependencies": [],
    "labels": [
      "receipt",
      "run"
    ],
    "provenance": {
      "actor_id": "HOLON-REVIEWER",
      "work_id": "work_example_run"
    },
    "stable_id": "dcp://apm2.local/receipts/run/review@2026-01-26T01:10:00Z"
  },
  "payload": {
    "run_id": "run_00042",
    "work_id": "work_example_run",
    "stage": "review",
    "context_pack_manifest_hash": "b3-256:9f8a8af29b5f2df4fa0e947f7bcb240bedd61d1a6b6d3f23b450b8e2f2f2d5cc",
    "target_profile_id": "dcp://apm2.local/targets/claude_code@v1",
    "context_pack_sufficiency": {
      "sufficient": false
    },
    "context_pack_miss": [
      {
        "stable_id": "dcp://apm2.local/skills/missing_review_rule@v1",
        "reason": "NOT_IN_PACK",
        "tool": "ArtifactFetch",
        "requested_at": "2026-01-26T01:10:12Z"
      }
    ],
    "budget_used": {
      "tokens": {
        "unit": "tokens",
        "value_i64": 42000
      },
      "tool_calls": {
        "unit": "count",
        "value_i64": 1
      }
    },
    "budget_remaining": {
      "tokens": {
        "unit": "tokens",
        "value_i64": 58000
      },
      "tool_calls": {
        "unit": "count",
        "value_i64": 0
      }
    }
  },
  "schema": "cac.run_receipt.v1",
  "schema_version": "1.0.0"
}
