{
  "kind": "instruction.spec",
  "schema": "cac.instruction_spec.v1",
  "schema_version": "1.0.0",
  "meta": {
    "classification": "INTERNAL",
    "created_at": "2026-01-28T00:00:00Z",
    "dependencies": [],
    "labels": [
      "rfc-council",
      "review-mode",
      "v0"
    ],
    "provenance": {
      "actor_id": "HOLON-INSTR-EMITTER",
      "work_id": "rfc_council_review_mode_v0"
    },
    "stable_id": "dcp://apm2.local/instructions/rfc_council/review_mode@v0"
  },
  "payload": {
    "i": "Review mode flow (load inputs, gate execution, refinement, bundle emit).",
    "pb": "Provide CAC-native review execution plan with refinement loop and verdict.",
    "t": {
      "sys": "APM2",
      "repo": "/home/ubuntu/Projects/apm2-rfc-consensus",
      "scope": [
        "documents/skills/rfc-council/references/review-mode.md"
      ]
    },
    "ctx": [
      "documents/skills/rfc-council/references/review-mode.md",
      "documents/skills/rfc-council/references/REVIEW_RUBRIC.md",
      "documents/skills/rfc-council/references/COUNCIL_PROTOCOL.md"
    ],
    "lex": {
      "R1": "Load RFC + tickets + CCP + latest evidence bundle; extract requirement_ids, ticket_ids, file_paths.",
      "R2": "Execute gates in invariant order; if FAIL with BLOCKER/MAJOR => propose edits, apply edits, delta-check, re-run gate once.",
      "R3": "Compute review depth from ticket count/cross-crate/net-new; COUNCIL if high impact.",
      "R4": "If COUNCIL depth, invoke council protocol.",
      "R5": "Emit new evidence bundle with gates, findings, verdict, council_metadata (if any).",
      "R6": "Verdict: REJECTED if blockers or >3 majors; APPROVED_WITH_REMEDIATION if 1-3 majors; else APPROVED."
    },
    "dir": [
      ["D1", 3, "@R1", ["inputs"], []],
      ["D2", 3, "@R2", ["gates"], []],
      ["D3", 3, "@R3", ["depth"], []],
      ["D4", 3, "@R4", ["council"], []],
      ["D5", 3, "@R5", ["output"], []],
      ["D6", 3, "@R6", ["verdict"], []]
    ],
    "g": [
      ["G-SOURCE", "D", 1, ["@R1", "@R2", "@R3", "@R4", "@R5", "@R6"], ["E1"], "FAIL_IF_MISSING"]
    ],
    "ev": [
      ["E1", "source_doc", true, "md", ["documents/skills/rfc-council/references/review-mode.md"], []]
    ],
    "chg": [
      ["C1", "CFG", ["documents/skills/rfc-council/references/review-mode.md"], ["documents/skills/rfc-council/references/review-mode.md#L1"], "Canonicalize review-mode flow into instruction.spec"]
    ],
    "r": {
      "depth": "M",
      "modes": [
        47,
        36,
        79
      ],
      "ob": [
        "A",
        "R",
        "I",
        "V",
        "E",
        "D",
        "S"
      ],
      "trace": "C"
    },
    "out": [
      ["instruction.spec", "dcp://apm2.local/instructions/rfc_council/review_mode@v0", "cac.instruction_spec.v1"]
    ],
    "q": [
      "Refinement loop includes re-run of failed gate",
      "Evidence bundle emitted every review"
    ]
  }
}
