{
  "kind": "receipt.admission",
  "meta": {
    "classification": "INTERNAL",
    "created_at": "2026-01-26T00:00:03Z",
    "dependencies": [],
    "labels": [
      "receipt",
      "admission"
    ],
    "provenance": {
      "actor_id": "HOLON-KERNEL-GATE",
      "work_id": "work_example_004"
    },
    "stable_id": "dcp://apm2.local/receipts/admission/skills_code_review@2026-01-26T00:00:03Z"
  },
  "payload": {
    "base_hash": "b3-256:a65b3b76c8238ad81db3926da6ce92590c0669fea1c4fa8bedc7b21d3534646f",
    "canonicalization": "CANON-JCS",
    "canonicalizer_id": "cac-canon",
    "canonicalizer_version": "cac-canon/1.0.0",
    "canonicalizer_vectors_ref": "dcp://apm2.local/canonicalizers/jcs_vectors@v1",
    "decision": "ADMIT",
    "new_hash": "b3-256:8f9969d8f0fa47a9f099447166718be0ade9d9e592457179b9e4e4589d05e906",
    "notes": [
      "Patch admitted; stable-id mapping updated in DCP projection."
    ],
    "patch_record_hash": "b3-256:2c6987f4276b4874f2dd7a24ecbc117720d76b27967614497886e5422ea9de70",
    "policy_hash": "b3-256:4ca2483e6d733cc5f9c45ae26d64b6ac26ea61a1c5949a6b924ea27d37f5ccfa",
    "receipt_id": "admission_receipt_0001",
    "schema_hash": "b3-256:f4a9be4e237a032561f0bdd9506e3d331f0053c95e333a5e6e38cc2fdfe88cce",
    "schema_id": "cac.skill_spec.v1",
    "target_stable_id": "dcp://apm2.local/skills/code_review@v1",
    "validator_version": "cac-validate/1.0.0"
  },
  "schema": "cac.admission_receipt.v1",
  "schema_version": "1.0.0"
}
